1,2,3,4,5,6
AI CMP DSP BPHY SE USPP IFA FMRP,MAECO DIS PHO FF KCES POL NMP DMG IPSY CDA,TCOM OOPD,,PRP MLBA I3D SPA MMS AOS,BECO ML CMPA ISC CMM ICF CF 
DIP ACB ROB RL ECOLL CIA RA CRN,SPP CISP GMT TA CBB ITTA MECO DVD IPHI CCS GA,AC CNT IMG CA NLP NDM EK,,CN FOMB GM DCS DSC TNT ACV,DA NB SCMP MAD TE BML DT WSI DHD 
IGA FCS AML AERM FSEM DSI HCAI,AI CMP DSP BPHY SE USPP IFA FMRP,CGAS IIA RMSSD CMOS CG RA-2 EC CFM PDCS,,RMSSD RA-2, 
DIP ACB ROB RL ECOLL CIA RA CRN,MAECO DIS PHO FF KCES POL NMP DMG IPSY CDA,AC CNT IMG CA NLP NDM EK,,PRP MLBA I3D SPA MMS AOS,BECO ML CMPA ISC CMM ICF CF 
IGA FCS AML AERM FSEM DSI HCAI,SPP CISP GMT TA CBB ITTA MECO DVD IPHI CCS GA EVS,CGAS IIA RMSSD CMOS CG RA-2 EC CFM PDCS,,CN FOMB GM DCS DSC TNT ACV,DA NB SCMP MAD TE BML DT WSI DHD EVS 